<?xml version="1.0" encoding="utf-8"?>
<?xml-stylesheet type="text/xsl" href="OyeComoVa.xsl"?>

<cancion xmlns:xsi="http://www.w3.org/2001/XMLSchema-instance" xsi:noNamespaceSchemaLocation="file:///C:/xampp/htdocs/OyeComoVa/OyeComoVa.xsd">
	<titulo>Oye como va</titulo>
	<autor>Tito Puente </autor>
	<interprete>Celia Cruz </interprete>
	<letra>
		
	<estrofa>
		
		<tipo>estribillo</tipo>
		<orden>1</orden>
		<verso><span>
			 Oye como va, mi ritmo
		</span>
			 
		</verso>
		Bueno pa' goza', mulata
			<verso>
			Oye como va, mi ritmo
			</verso>
				<verso>
					Bueno pa' goza', mulata
				</verso>
					
						
	</estrofa>
	
	
	<estrofa >-2
		<tipo>normal</tipo>
		<orden>2</orden>
			<verso>Si tú no sabes bailar
				
			</verso>
				<verso>
					Si estás peleado con el son
				</verso>
					<verso>
						Sígueme marcando el paso
					</verso>
						<verso>
						Que te aseguro que es de lo más sabrosón
						</verso>
							
	</estrofa>
	<tipo>normal</tipo>
	<estrofa >
		<orden>3</orden>
			<verso>
			Voy pa' la rumba, la rumba, la rumba
			</verso>
				<verso>
				Porque me llama, me llama, me llama
				</verso>
					<verso>
						Y necesito que suene el coro
					</verso>
						<verso>
							Para que se ponga a vacilar
						</verso>
							
	</estrofa>
	<tipo>estribillo</tipo>
	<estrofa >
		<orden>4</orden>
			<verso>
				Oye como va, mi ritmo
			</verso>
				<verso>
				Bueno pa' goza', mulata

				</verso>
				Oye como ya, mi ritmo
					<verso>
						Bueno pa' goza', mulata
					</verso>

	</estrofa>
	<estrofa>
			<orden>5</orden>
			<tipo>estribillo</tipo>
		<verso>
		Esto se pone caliente
		</verso>
		<verso>
		Esto se baila apretado
		</verso>
		<verso>
		Cuatro pasitos pa'l frente
		</verso>
		<verso>
			Y un meneíto de lao
		</verso>
		
	</estrofa>
	
	</letra>/letra>
</cancion>